number,value,params_cloud_lags_option,params_colsample_bytree,params_compute_air_density,params_compute_cloud_cover_fraction,params_compute_cooling_degree_hours,params_compute_dew_point_spread,params_compute_effective_solar,params_compute_heating_degree_hours,params_compute_humidex,params_compute_pressure_trend,params_compute_rain_indicator,params_compute_temp_gradient,params_compute_wind_chill,params_compute_wind_components,params_compute_wind_power_density,params_compute_wind_speed_gradient,params_drop_basic_meteo_features,params_drop_rad_meteo_features,params_drop_wind_meteo_features,params_learning_rate,params_max_depth,params_min_child_samples,params_min_split_gain,params_n_estimators,params_num_leaves,params_precip_lags_option,params_reg_alpha,params_reg_lambda,params_rolling_temp_option,params_spatial_agg_method,params_subsample,params_temp_lags_option,params_use_base_models_pred_intervals,state
68,1993.6111109175029,none,0.5257617635466976,True,False,False,False,True,True,True,True,False,False,False,False,False,False,True,True,False,0.01239516671202278,10,60,0.10432923808061484,383,34,none,0.006577973593130935,2.092896837105e-07,long,None,0.8241171092600785,small,False,COMPLETE
69,1969.7248433990555,none,0.5229745994612748,True,False,False,False,True,True,True,True,False,False,False,False,False,False,True,False,False,0.012127596260898738,10,59,0.1025751697765934,386,33,none,0.007188439110460984,1.7446463467490356e-07,long,None,0.7685168308188585,small,False,COMPLETE
